{
  "schema_version": 1,
  "name": "MTS NET — черновой профиль PoC",
  "version": "2026-09-04",
  "role": "Аналитик с ракурсами разработчика и тестировщика",
  "goal": "Найти места, которые стоит дополнить или скорректировать перед передачей ТЗ на поток или витрину данных в разработку",
  "checks": [
    "Расположение источников и Kafka-кластеров",
    "Поля и логика расчёта",
    "Фильтрация данных",
    "Обновление, регламент и объём данных",
    "Согласованность разделов и проверяемость требований"
  ],
  "context_files": [
    "../../sources/case-brief.txt",
    "../../document-analysis.md",
    "../../sources/test-data.extracted.md"
  ]
}
