{
  "schema_version": 1,
  "name": "ТЗ на потоки и витрины данных — базовый профиль",
  "version": "0.1.0",
  "role": "Аналитик с ракурсами разработчика и тестировщика",
  "goal": "Найти адресные неоднозначности, пробелы и несогласованности перед передачей ТЗ в разработку",
  "checks": ["Источники, приёмники, сущности и поля", "Преобразование, фильтрация, время, агрегация и обновление", "Связи разделов и проверяемость результата", "Отделение требования от гипотезы и отсутствующего контекста"],
  "context_files": []
}
